### ISSUE TITLE
Over the internet multiplayer does not work(?)

### ISSUE THREAD

**Issue by etosan** [andrei-drexler/ironwail#492]
We wasted several hours on this, but it seems something is seriously broken with over the internet multiplayer.

Both test machines are behind NAT, on both sides, but UDP port forwarding rules are set on both endpoint "routers". For simplicity, both UDP AND TCP are setup, albeit according to quakespasm docs. only UDP on 26000 is sufficient.

Setting up `nc` `netcat` on both sides both TCP and UDP works, I can see my partner typing and sending and receive messages bidirectionally:
```
node1:
nc -vl 26000
...
text
...

node2:
nc -v ${ip} 26000
...
text
...
```
UDP as well
```
node1:
nc -v -ul 26000
...
text
...

node2:
nc -v -u ${ip} 26000
...
text
...
```

This works in both directions.

However, when any of us tries to connect to running `ironwail` server (started alongside the game, from game menu multiplayer) on the server all we get is this:
```
player entered the game
NET_GetMessage: disconnected socket
SV_ReadClientMessage: NET_GetMessage failed
Client unconnected removed
NET_GetMessage: disconnected socket
```

On the client is looks like this:
```
connect xx.xx.xx.xx
trying...
Connection accepted
```
And then nothing...

Ironwail is listening (not exactly sure what the second port is for, it seem ephemeral).
```
: ss -tunlp | grep ironwail
udp                      UNCONN                    0                         0                                                  0.0.0.0:45718                                            0.0.0.0:*                        users:(("ironwail",pid=8935,fd=5))                     
udp                      UNCONN                    0                         0                                                  0.0.0.0:26000                                            0.0.0.0:*                        users:(("ironwail",pid=8935,fd=1
```

When I run second instance of ironwail on the same computer, or from local network, I connect to the server just fine, and I can see a player.
Most surprising thing is, that if we fire up `fteqw` as server instead, the other one of us connects to it with `ironwail` over internet just fine and everything works. This point to some serious breakage in ironwail itself and seems to be limited to over the internet play.

Tracing connection attempt between two `ironwails` with `tcpdump` always looks like this (traced on server):
```
: sudo tcpdump -i cable1 port 26000
tcpdump: verbose output suppressed, use -v[v]... for full protocol decode
listening on cable1, link-type EN10MB (Ethernet), snapshot length 262144 bytes
22:24:17.631454 IP client_ip.56761 > server_ip.quake: UDP, length 12
22:24:20.131548 IP client_ip.56761 > server_ip.quake: UDP, length 12
22:24:20.140422 IP server_ip.quake > client_ip.56761: UDP, length 9
```
And then nothing, when trying server on both sides.

Given `fteqw` and combination `fteqw`+`ironwail` works my bet is some bug in server core but i am not sure. Unfotunately as far as I know fteqw cannot play kex/nightdive content (as far as I know), and we would really like to play it together, so `ironwail` it is. 

Can this be looked into, please?

**Comment by TheD3vilsAdvocate** [comment]
I'm getting similar issues:

Host_Error: CL_Connect: connect failed
trying...
Connection accepted
WINS_Read, recvfrom: Connection reset by peer
Read error
Host_Error: CL_ReadFromServer: lost server connection

And on the Server:
 WINS_Read, recvfrom: Connection reset by peer
 Read error
 SV_ReadClientMessage: NET_GetMessage failed
 Client unconnected removed



All ports forwarded, game files exactly the same, local connectivity works just fine, firewall is off...
No idea how to proceed.

**Comment by etosan** [comment]
With 30th year Quake anniversary and mgs3 mod we, me and my brother, gave it a try again, but the networking situation is abysmal.

We went through every possible solution besides looking at wireshark dumps, but eventually, given I am getting so pissed, I will look even into that :D.

Currently we tried even `tailscale`. 

Again connection "works" in all cases (NAT, tailscale, etc) but game cucks up:
```
]connect 1xx.xxx.xxx.xx5
trying...
still trying...
Connection accepted
```

On sever we get better diagnostic output:
```
Forged packet received
Expected: 0200xxxaaxxx7786a0000000000000000 
Received: 0200xxxabxxx7786a0000000000000000
```

Analyzing it seems something is getting mangled in packets. Keep in mind that both machines are multi-interface beasts, but that does not excuse inability to work. Enforcing `-ip xxx.xxx.xxx.xxx` for proper interface, doesn't do anything either.

@andrei-drexler seeing you active with quake 30 years anniversary, wouldn't you be willing undertake modernization of netcode from QSS-M or FTE? You already support modern protos like 999, single UDP port 26000 operation would be really gift from heaven for many people.

We tried native steam kexengine, but it has it's own issues, and given it's nightidive/bethesda the comms with them would be real blackhole, as they work in fire and forget mode, ignoring community.

Ironwail is only modern fork able to play current/recent content, so having working coop would be incredible addition to quakeverse...

**Comment by pewbert** [comment]
I had the exact same problem y'all are describing. the new Dawn of the Machine came out/30th rerelease. 
Decided to stand up a dedicated server
Same issues:
Turns out the problem was the firewall setting which shuffles "NAT Outbound" ports dynamically.
So you get those Forged Packet received errors.

pfSense and OPNsense both do it by default, some of the other firewall solutions out there also provide similar functionality.

I turned off automatic rule generation and enabled Manual rules only on OpnSense:
created 2 manual rules:

<img width="1805" height="227" alt="Image" src="https://github.com/user-attachments/assets/3628c673-156a-456c-a521-8ccd590e7b2f" />

**Comment by etosan** [comment]
Yes, we got suggested port mangling by AIs as well, but I am not sure what could be mangling ports on NAT in my infra, but will look into it.

What I don't understand is why port mangling matters, does ironwail/quake store somewhere "in-protocol" ip:port pairs within packets that then don't match to data in actual packet ip headers? Or what is the catch here?

However, even if it's port mangling, I believe it to be issue of older quake networking handling, where ephemeral ports are being used for comms, in addition to 26000. I think both FTE, QSS and QSS-M mentioned above support single port operation, which would be much simpler for users.

**Comment by TheD3vilsAdvocate** [comment]
not sure how I got my servers running. Maybe I can provide some info

I'm launching the exe with: 
"C:\Games\Quake 2\QSS-M-w64.exe" -dedicated +map e1m1 +deathmatch 1 -port 26001 -ip 10.10.51.2

IP being the local IP of the host. Without that, I can't connect from either the internet or locally.

Plus port forwarding on the router of course...

**Comment by pewbert** [comment]
> Yes, we got suggested port mangling by AIs as well, but I am not sure what could be mangling ports on NAT in my infra, but will look into it.
> 
> What I don't understand is why port mangling matters, does ironwail/quake store somewhere "in-protocol" ip:port pairs within packets that then don't match to data in actual packet ip headers? Or what is the catch here?
> 
> However, even if it's port mangling, I believe it to be issue of older quake networking handling, where ephemeral ports are being used for comms, in addition to 26000. I think both FTE, QSS and QSS-M mentioned above support single port operation, which would be much simpler for users.

you pretty much hit the nail on the head.
https://en.wikipedia.org/wiki/User_Datagram_Protocol

yes the source port and destination port are part of the udp packet. so it all needs to match up.
less overhead this way, but lacks fidelity.because of this you cant be switching up the ports on the fly and expecting it to work.
so the dedicated server builds the socket (ip:port) and listens on that port for a udp packet that matches that port where source and destination match the socket port. if one of the three gets changed you get the error.
so it all needs to be 1:1:1 (clinet-tx)source:translation:destination(socket-rx)

**Comment by etosan** [comment]
Thanks @pewbert.

It's some time I dived into quake protocols shenanigans.

Indeed it seems documented here: https://fabiensanglard.net/quakeSource/quakeSourceNetWork.php

Since Fabien probably changed site design and broke direct anchor linking, these are relevant sections:
- NetChannel Header
- More on the qport

Seems _**QuakeWorld**_ style clients use internal `qport` field, which could be thought of as of `session_id` per `ip`, by which QW server recognizes the clients, even if sender ports become "mangled".

And as you said, it seems like `ironwail` uses purely original _**NetQuake**_ `src_ip:src_port`<->`dst_ip:dst_port` mappings. I will try to ask my bro, which setting modifies `tailscale` router to preserve the port map.

@pewbert given you are pfSense and OPNsense user perhaps you have knowledge of `pf`? I am using `pf ` in my outermost bastion host so it should be possible to replicate you "clickety" settings in pf.conf?

@andrei-drexler digging deeper into it it seems fteqw and _**Quakespasm Spiked**_ and _**Quakespasm Spiked M**_ don't actually use quakeworld, as I assumed, but modified _**NetQuake**_, would it be in your area of interest adding their code? Or are you interested solely in rendering?

However I am surprised how well _**NetQuake**_ works over `tailscale`. We get sub 20ms pings, it's silky smooth up to 4 players, missing clientside prediction is non-issue. Single FTE's/QSS single port operation would be great QoL improvement.

**Comment by etosan** [comment]
Update for anyone using `tailscale`,on `tailnet` enabling advertise routes turns node into tailscale "router" as far as I understand. Disabling snat disables any packet delivery mangling:
```
tailscale up --snat-subnet-routes=false -accept-dns=false --accept-routes --advertise-routes=10.x.x.x/16
```

Classic FreeBSD/Linux shenanigans apply (respective ip.forwarding sysctls, routes have to be specified) and actual in-network router has to have routes back to tailnet range `100.64.0.0/10`.

https://tailscale.com/docs/reference/troubleshooting/network-configuration/disable-subnet-route-masquerading
https://tailscale.com/docs/features/subnet-routers#disable-snat
